{"checkpoint_actual_tokens":{"B":2015232,"F":2015232,"H":2015232,"R":2015232},"checkpoint_target_tokens":2000000,"common_full_ffn_sst":538589430.5023804,"completed_at":"2026-07-29T10:38:02.634246Z","conditions":{"B":{"candidates_per_token":8192,"condition":"B","cumulative_training_coverage":{"fired_features":8192,"firing_fraction":1.0,"total_features":8192},"error_cancellation_sse_delta":null,"exact_l0":64,"finite":true,"full_ffn":{"ev":0.44065576678845453,"nmse":0.5593442332115455,"sse":301256892.0201969,"sst":538589430.5023804},"heldout_nonfiring":{"fired_features":8192,"nonfiring_fraction":0.0,"total_features":8192},"nominal_exposure_fraction":1.0,"oracle_routed_full_ffn":null,"oracle_shared_full_ffn":null,"routed":null,"routed_bank_exposure":[],"shared":null,"total_features":8192,"training":{"accelerator_generation":"v4","accelerator_type":"v4-32","checkpoint_firing_mask_sha256":"a800e747734a79d2a7460342b9687ad2d11d720f80042ecb4ede373df3f07b27","chip_count":16,"marginal_chip_seconds":14938.165197372437,"tokens_per_second":2158.4787404594736,"training_receipt_sha256":"79bf5064122f1539c1d54f5bd037ba09b4418a68a7b5b0b3cc3abcb9c9bb80b3","useful_mfu":0.0004804533475633091,"wall_seconds":933.6353248357773}},"F":{"candidates_per_token":69632,"condition":"F","cumulative_training_coverage":{"fired_features":69632,"firing_fraction":1.0,"total_features":69632},"error_cancellation_sse_delta":null,"exact_l0":64,"finite":true,"full_ffn":{"ev":0.4544139671927552,"nmse":0.5455860328072448,"sse":293846870.69970703,"sst":538589430.5023804},"heldout_nonfiring":{"fired_features":69632,"nonfiring_fraction":0.0,"total_features":69632},"nominal_exposure_fraction":1.0,"oracle_routed_full_ffn":null,"oracle_shared_full_ffn":null,"routed":null,"routed_bank_exposure":[],"shared":null,"total_features":69632,"training":{"accelerator_generation":"v4","accelerator_type":"v4-32","checkpoint_firing_mask_sha256":"8edc49ade0b7aa4e76768d5b994238ca8ea7d2f07e386227d36b7b444e2f3dd1","chip_count":16,"marginal_chip_seconds":16964.366388320923,"tokens_per_second":1900.6729318342302,"training_receipt_sha256":"f70ae15170b4ce48c25b09452fd2fbd788aa8f48873f5e65f3a2dfb6a668bae2","useful_mfu":0.0026072688860514794,"wall_seconds":1060.2728992700577}},"H":{"candidates_per_token":8192,"condition":"H","cumulative_training_coverage":{"fired_features":69561,"firing_fraction":0.9989803538602942,"total_features":69632},"error_cancellation_sse_delta":-48729488.605986595,"exact_l0":64,"finite":true,"full_ffn":{"ev":0.3613043775518703,"nmse":0.6386956224481297,"sse":343994711.5587015,"sst":538589430.5023804},"heldout_nonfiring":{"fired_features":67469,"nonfiring_fraction":0.031063304227941124,"total_features":69632},"nominal_exposure_fraction":0.11764705882352941,"oracle_routed_full_ffn":{"ev":0.7322214937768379,"nmse":0.26777850622316207,"sse":144222673.167511,"sst":538589430.5023804},"oracle_shared_full_ffn":{"ev":0.5386067514073156,"nmse":0.46139324859268444,"sse":248501526.99717712,"sst":538589430.5023804},"routed":{"ev":-0.8611348872915996,"nmse":1.8611348872915996,"sse":30424745780.992188,"sst":16347415756.236526},"routed_bank_exposure":[{"bank_features":512,"bank_id":0,"cumulative_training_fired_features":512,"heldout_fired_features":500,"routed_evaluation_components":1040,"routed_training_components":14898},{"bank_features":512,"bank_id":1,"cumulative_training_fired_features":512,"heldout_fired_features":512,"routed_evaluation_components":10643,"routed_training_components":88787},{"bank_features":512,"bank_id":2,"cumulative_training_fired_features":512,"heldout_fired_features":512,"routed_evaluation_components":19434,"routed_training_components":172925},{"bank_features":512,"bank_id":3,"cumulative_training_fired_features":512,"heldout_fired_features":512,"routed_evaluation_components":26253,"routed_training_components":208979},{"bank_features":512,"bank_id":4,"cumulative_training_fired_features":512,"heldout_fired_features":511,"routed_evaluation_components":25146,"routed_training_components":210533},{"bank_features":512,"bank_id":5,"cumulative_training_fired_features":512,"heldout_fired_features":512,"routed_evaluation_components":38216,"routed_training_components":362276},{"bank_features":512,"bank_id":6,"cumulative_training_fired_features":512,"heldout_fired_features":512,"routed_evaluation_components":15419,"routed_training_components":121609},{"bank_features":512,"bank_id":7,"cumulative_training_fired_features":512,"heldout_fired_features":472,"routed_evaluation_components":4245,"routed_training_components":35702},{"bank_features":512,"bank_id":8,"cumulative_training_fired_features":512,"heldout_fired_features":512,"routed_evaluation_components":2823,"routed_training_components":26226},{"bank_features":512,"bank_id":9,"cumulative_training_fired_features":512,"heldout_fired_features":512,"routed_evaluation_components":9417,"routed_training_components":82431},{"bank_features":512,"bank_id":10,"cumulative_training_fired_features":512,"heldout_fired_features":420,"routed_evaluation_components":1576,"routed_training_components":14134},{"bank_features":512,"bank_id":11,"cumulative_training_fired_features":512,"heldout_fired_features":512,"routed_evaluation_components":30503,"routed_training_components":239224},{"bank_features":512,"bank_id":12,"cumulative_training_fired_features":512,"heldout_fired_features":512,"routed_evaluation_components":22250,"routed_training_components":179728},{"bank_features":512,"bank_id":13,"cumulative_training_fired_features":512,"heldout_fired_features":512,"routed_evaluation_components":12287,"routed_training_components":113578},{"bank_features":512,"bank_id":14,"cumulative_training_fired_features":512,"heldout_fired_features":512,"routed_evaluation_components":25128,"routed_training_components":152798},{"bank_features":512,"bank_id":15,"cumulative_training_fired_features":512,"heldout_fired_features":503,"routed_evaluation_components":1066,"routed_training_components":10932},{"bank_features":512,"bank_id":16,"cumulative_training_fired_features":512,"heldout_fired_features":512,"routed_evaluation_components":1695,"routed_training_components":12783},{"bank_features":512,"bank_id":17,"cumulative_training_fired_features":512,"heldout_fired_features":512,"routed_evaluation_components":11497,"routed_training_components":105982},{"bank_features":512,"bank_id":18,"cumulative_training_fired_features":512,"heldout_fired_features":512,"routed_evaluation_components":7593,"routed_training_components":61236},{"bank_features":512,"bank_id":19,"cumulative_training_fired_features":512,"heldout_fired_features":512,"routed_evaluation_components":3105,"routed_training_components":23242},{"bank_features":512,"bank_id":20,"cumulative_training_fired_features":512,"heldout_fired_features":501,"routed_evaluation_components":5353,"routed_training_components":55772},{"bank_features":512,"bank_id":21,"cumulative_training_fired_features":512,"heldout_fired_features":512,"routed_evaluation_components":24742,"routed_training_components":203571},{"bank_features":512,"bank_id":22,"cumulative_training_fired_features":512,"heldout_fired_features":512,"routed_evaluation_components":21186,"routed_training_components":184446},{"bank_features":512,"bank_id":23,"cumulative_training_fired_features":512,"heldout_fired_features":512,"routed_evaluation_components":16835,"routed_training_components":153141},{"bank_features":512,"bank_id":24,"cumulative_training_fired_features":512,"heldout_fired_features":512,"routed_evaluation_components":3138,"routed_training_components":28117},{"bank_features":512,"bank_id":25,"cumulative_training_fired_features":512,"heldout_fired_features":512,"routed_evaluation_components":31994,"routed_training_components":268331},{"bank_features":512,"bank_id":26,"cumulative_training_fired_features":512,"heldout_fired_features":512,"routed_evaluation_components":15299,"routed_training_components":81287},{"bank_features":512,"bank_id":27,"cumulative_training_fired_features":512,"heldout_fired_features":512,"routed_evaluation_components":25394,"routed_training_components":219154},{"bank_features":512,"bank_id":28,"cumulative_training_fired_features":512,"heldout_fired_features":512,"routed_evaluation_components":29788,"routed_training_components":279069},{"bank_features":512,"bank_id":29,"cumulative_training_fired_features":512,"heldout_fired_features":511,"routed_evaluation_components":11576,"routed_training_components":92274},{"bank_features":512,"bank_id":30,"cumulative_training_fired_features":512,"heldout_fired_features":512,"routed_evaluation_components":9798,"routed_training_components":71185},{"bank_features":512,"bank_id":31,"cumulative_training_fired_features":488,"heldout_fired_features":252,"routed_evaluation_components":107,"routed_training_components":849},{"bank_features":512,"bank_id":32,"cumulative_training_fired_features":512,"heldout_fired_features":512,"routed_evaluation_components":20650,"routed_training_components":204652},{"bank_features":512,"bank_id":33,"cumulative_training_fired_features":512,"heldout_fired_features":512,"routed_evaluation_components":19102,"routed_training_components":121330},{"bank_features":512,"bank_id":34,"cumulative_training_fired_features":512,"heldout_fired_features":512,"routed_evaluation_components":22075,"routed_training_components":192703},{"bank_features":512,"bank_id":35,"cumulative_training_fired_features":512,"heldout_fired_features":512,"routed_evaluation_components":15682,"routed_training_components":126165},{"bank_features":512,"bank_id":36,"cumulative_training_fired_features":512,"heldout_fired_features":512,"routed_evaluation_components":26900,"routed_training_components":214120},{"bank_features":512,"bank_id":37,"cumulative_training_fired_features":512,"heldout_fired_features":512,"routed_evaluation_components":15695,"routed_training_components":122419},{"bank_features":512,"bank_id":38,"cumulative_training_fired_features":467,"heldout_fired_features":223,"routed_evaluation_components"